Κ34Μ;Δερματικά έλκη σε διαταραχές του κυκλοφορικού με καταστροφικές (συστηματικές) ή σοβαρές συνυπάρχουσες παθήσεις-επιπλοκές;2030;13
Κ34Χ;Δερματικά έλκη σε διαταραχές του κυκλοφορικού χωρίς καταστροφικές (συστηματικές) ή σοβαρές συνυπάρχουσες παθήσεις-επιπλοκές;891;5
Κ35Μ;Περιφερική αγγειακή νόσος με καταστροφικές (συστηματικές) ή σοβαρές  συνυπάρχουσες παθήσεις-επιπλοκές;1365;7
Κ35Χ;Περιφερική αγγειακή νόσος  χωρίς καταστροφικές (συστηματικές) ή σοβαρές συνυπάρχουσες παθήσεις-επιπλοκές;474;2
Κ36Μ;Αθηρωμάτωση στεφανιαίων αρτηριών με καταστροφικές (συστηματικές) ή σοβαρές συνυπάρχουσες παθήσεις-επιπλοκές;865;5
Κ36Χ;Αθηρωμάτωση στεφανιαίων αρτηριών χωρίς καταστροφικές (συστηματικές) ή σοβαρές  συνυπάρχουσες παθήσεις-επιπλοκές;340;2
Κ37Μ;Αρτηριακή υπέρταση με καταστροφικές (συστηματικές) ή σοβαρές συνυπάρχουσες παθήσεις-επιπλοκές;1089;6
Κ37Χ;Αρτηριακή υπέρταση χωρίς καταστροφικές (συστηματικές) ή σοβαρές συνυπάρχουσες παθήσεις-επιπλοκές;355;2
Κ38Α;Συγγενής καρδιοπάθεια με περίπλοκη θεραπεία πολυανθεκτικών παθογόνων μικροοργανισμών, ασθενειών και παθήσεων του κυκλοφορικού συστήματος;3500;4
Κ38Μ;Συγγενής καρδιοπάθεια με συνυπάρχουσες παθήσεις-επιπλοκές;1167;4
Κ38Χ;Συγγενής καρδιοπάθεια χωρίς συνυπάρχουσες παθήσεις-επιπλοκές;570;1
Κ39Μ;Βαλβιδοπάθειες με καταστροφικές (συστηματικές) ή σοβαρές συνυπάρχουσες παθήσεις-επιπλοκές;1153;6
Κ39Χ;Βαλβιδοπάθειες χωρίς καταστροφικές (συστηματικές) ή σοβαρές  συνυπάρχουσες παθήσεις-επιπλοκές;297;2
Κ40Μ;Διαταραχές του κυκλοφορικού με ΟΕΜ (οξύ έμφραγμα μυοκαρδίου)  χωρίς επεμβατικό καρδιακό καθετηριασμό, με καταστροφικές (συστηματικές) συνυπάρχουσες παθήσεις-επιπλοκές;1818;10
Κ40Χ;Διαταραχές του κυκλοφορικού με ΟΕΜ (οξύ έμφραγμα μυοκαρδίου)  χωρίς επεμβατικό καρδιακό καθετηριασμό, χωρίς καταστροφικές (συστηματικές) συνυπάρχουσες παθήσεις-επιπλοκές;722;3
Κ41Μ;Λοιμώδης ενδοκαρδίτιδα με καταστροφικές (συστηματικές) συνυπάρχουσες παθήσεις-επιπλοκές;4365;22
Κ41Χ;Λοιμώδης ενδοκαρδίτιδα χωρίς καταστροφικές (συστηματικές) συνυπάρχουσες παθήσεις-επιπλοκές;2179;12
Κ42Μ;Καρδιακή ανεπάρκεια και καταπληξία με καταστροφικές (συστηματικές) συνυπάρχουσες παθήσεις-επιπλοκές;1868;10
Κ42Χ;Καρδιακή ανεπάρκεια και καταπληξία χωρίς καταστροφικές (συστηματικές) συνυπάρχουσες παθήσεις-επιπλοκές;849;5
Κ43Μ;Συγκοπή και collapsus με καταστροφικές (συστηματικές) ή σοβαρές συνυπάρχουσες παθήσεις-επιπλοκές;1012;8
Κ43Χ;Συγκοπή και collapsus χωρίς καταστροφικές (συστηματικές) ή σοβαρές συνυπάρχουσες παθήσεις-επιπλοκές;361;2
Κ44Α;Θωρακικό / προκάρδιο άλγος;310;1
Κ45Μα;Άλλες παθήσεις του κυκλοφορικού  με καταστροφικές (συστηματικές) συνυπάρχουσες παθήσεις-επιπλοκές;2207;10
Κ45Μβ;Άλλες παθήσεις του κυκλοφορικού  με σοβαρές ή μέτριας βαρύτητας συνυπάρχουσες παθήσεις-επιπλοκές;927;4
Κ45Χ;Άλλες παθήσεις του κυκλοφορικού  χωρίς συνυπάρχουσες παθήσεις-επιπλοκές;521;2
Κ46Μ;Αρρυθμία, καρδιακή ανακοπή και διαταραχές  αγωγιμότητας με καταστροφικές (συστηματικές) ή σοβαρές συνυπάρχουσες παθήσεις-επιπλοκές;1245;6
Κ46Χ;Αρρυθμία, καρδιακή ανακοπή και διαταραχές αγωγιμότητας χωρίς καταστροφικές (συστηματικές) ή σοβαρές συνυπάρχουσες παθήσεις-επιπλοκές;444;2
Κ47Μ;Ασταθής στηθάγχη με καταστροφικές (συστηματικές) ή σοβαρές συνυπάρχουσες παθήσεις-επιπλοκές;940;10
Κ47Χ;Ασταθής στηθάγχη χωρίς καταστροφικές (συστηματικές) ή σοβαρές συνυπάρχουσες παθήσεις-επιπλοκές;424;5
Κ48Α;Απλή ηλεκτροφυσιολογική μελέτη;1500;2
Κ49Μα;Ηλεκτροφυσιολογική μελέτη και επέμβαση κατάλυσης  σε υπερκοιλιακές/κοιλιακές ταχυκαρδίες με σύστημα χαρτογράφησης και/ή εξειδικευμένους καθετήρες και κολπική διαφραγματοστομία;9500;3
Κ49Μβ;Ηλεκτροφυσιολογική μελέτη και επέμβαση κατάλυσης  σε υπερκοιλιακές/κοιλιακές  ταχυκαρδίες με σύστημα χαρτογράφησης και/ή εξειδικευμένους καθετήρες χωρίς κολπική διαφραγματοστομία;8200;3
Κ49Μγ;Απλή ηλεκτροφυσιολογική μελέτη και επέμβαση κατάλυσης σε υπερκοιλιακές/κοιλιακές ταχυκαρδίες με κολπική διαφραγματοστομία;6300;3
Κ49Χ;Απλή ηλεκτροφυσιολογική μελέτη και επέμβαση κατάλυσης  σε υπερκοιλιακές/κοιλιακές ταχυκαρδίες χωρίς σύστημα χαρτογράφησης και χωρίς κολπική διαφραγματοστομία;4700;3
Κ50Α;Κατάλυση νευρικού πλέγματος νεφρικής αρτηρίας;5000;4
Κ51Α;Εμφύτευση συσκευής συνεχούς ΗΚΓφικής καταγραφής τύπου κλειστής αγκύλης (Insertable loop recorders);2500;2
Κ52Μ;Εμφύτευση αμφικοιλιακού απινιδωτή, ολοκληρωμένο σύστημα, με καταστροφικές συνυπάρχουσες παθήσεις - επιπλοκές;15000;12
Κ52Χ;Εμφύτευση αμφικοιλιακού απινιδωτή, ολοκληρωμένο σύστημα, χωρίς καταστροφικές συνυπάρχουσες παθήσεις - επιπλοκές;14500;3
Κ53Μ;Αντικατάσταση αμφικοιλιακού απινιδωτή, ολοκληρωμένο σύστημα, με καταστροφικές συνυπάρχουσες παθήσεις - επιπλοκές;13500;12
Κ53Χ;Αντικατάσταση αμφικοιλιακού απινιδωτή, ολοκληρωμένο σύστημα, χωρίς καταστροφικές συνυπάρχουσες παθήσεις - επιπλοκές;12500;3
Κ54Μ;Εμφύτευση αμφικοιλιακού βηματοδότη ολοκληρωμένο σύστημα, με καταστροφικές συνυπάρχουσες παθήσεις - επιπλοκές;5000;12
Κ54Χ;Εμφύτευση αμφικοιλιακού βηματοδότη ολοκληρωμένο σύστημα, χωρίς καταστροφικές συνυπάρχουσες παθήσεις - επιπλοκές;4500;3
Κ55Μ;Αντικατάσταση αμφικοιλιακού βηματοδότη, ολοκληρωμένο σύστημα, με καταστροφικές συνυπάρχουσες παθήσεις - επιπλοκές;5000;12
Κ55Χ;Αντικατάσταση αμφικοιλιακού βηματοδότη ολοκληρωμένο σύστημα, χωρίς καταστροφικές συνυπάρχουσες παθήσεις - επιπλοκές;4500;3
Κ56Μ;Διακαθετηριακή τοποθέτηση καρδιακής βαλβίδας με καταστροφικές συνυπάρχουσες παθήσεις-επιπλοκές;15000;12
Κ56Χ;Διακαθετηριακή τοποθέτηση καρδιακής βαλβίδας χωρίς καταστροφικές συνυπάρχουσες παθήσεις-επιπλοκές;13000;8
Κ57Μ;Διακορυφαία δια-αορτική τοποθέτηση καρδιακής βαλβίδας με καταστροφικές συνυπάρχουσες παθήσεις-επιπλοκές;16000;12
Κ57Χ;Διακορυφαία δια-αορτική τοποθέτηση καρδιακής βαλβίδας χωρίς καταστροφικές συνυπάρχουσες παθήσεις-επιπλοκές;14000;10
Κ58Μ;Διακαθετηριακή βαλβιδοπλαστική καρδιακής βαλβίδας με καταστροφικές συνυπάρχουσες παθήσεις-επιπλοκές;4000;5
Κ58Χ;Διακαθετηριακή βαλβιδοπλαστική καρδιακής βαλβίδας χωρίς καταστροφικές συνυπάρχουσες παθήσεις-επιπλοκές;3000;4
Κ59Α;Διακαθετηριακή αντικατάσταση ή διόρθωση καρδιακών βαλβίδων χωρίς καταστροφικές συνυπάρχουσες παθήσεις - επιπλοκές;5500;8
Κ60Α;Διακαθετηριακή αντιμετώπιση μυοκαρδιοπάθειας, χωρίς καταστροφικές συνυπάρχουσες παθήσεις/επιπλοκές;6500;4
Κ61Α;Διαδερμική - διακαθετηριακή τοποθέτηση συσκευών σε καρδιακή κοιλότητα ή σύγκλειση καρδιακών τρημάτων;13000;3
Κ62Α;Επεμβατική σύγκλειση μεσοκολπικού ή μεσοκοιλιακού ελλείμματος σε ασθενή <18 ετών;15000;5
Κ63Α;Επεμβατική σύγκλειση αρτηριακού πόρου σε ασθενή <18 ετών;9000;5
Κ64Α;Επεμβατική σύγκλειση αορτοπνευμονικού παράπλευρου σε ασθενή <18 ετών;4000;5
Κ65Α;Επεμβατική διάνοιξη μεσοκολπικής επικοινωνίας σε ασθενή <18 ετών;2000;5
Κ66Μ;Βαλβιδοπλαστική ή αγγειοπλαστική για συγγενή καρδιοπάθεια σε ασθενή <18 ετών με καταστροφικές ή σοβαρές συνυπάρχουσες παθήσεις-επιπλοκές;5500;5
Κ66Χ;Βαλβιδοπλαστική ή αγγειοπλαστική για συγγενή καρδιοπάθεια σε ασθενή <18 ετών χωρίς καταστροφικές ή σοβαρές συνυπάρχουσες παθήσεις-επιπλοκές;5000;5
Κ67Α;Τοποθέτηση ενδοπρόθεσης (stent) σε πνευμονική αρτηρία ή στην περιοχή του ισθμού σε ασθενή <18 ετών;3500;5
Λ01Μ;Τοκετός με καισαρική τομή με καταστροφικές (συστηματικές) ή σοβαρές συνυπάρχουσες παθήσεις - επιπλοκές;1300;7
Λ01Χ;Τοκετός με καισαρική τομή χωρίς καταστροφικές (συστηματικές) ή σοβαρές συνυπάρχουσες παθήσεις - επιπλοκές;1000;4
Λ02Μ;Κολπικός τοκετός με χειρουργική επέμβαση με καταστροφικές (συστηματικές) ή σοβαρές συνυπάρχουσες παθήσεις - επιπλοκές;1100;5
Λ02Χ;Κολπικός τοκετός με χειρουργική επέμβαση χωρίς καταστροφικές (συστηματικές) ή σοβαρές συνυπάρχουσες παθήσεις - επιπλοκές ;800;4
Λ03Μ;Έκτοπη κύηση με καταστροφικές (συστηματικές) συνυπάρχουσες παθήσεις - επιπλοκές;900;4
Λ03Χ;Έκτοπη κύηση χωρίς καταστροφικές (συστηματικές) συνυπάρχουσες παθήσεις - επιπλοκές;650;3
Λ04Μ;Καταστάσεις μετά τον τοκετό ή μετά την άμβλωση με χειρουργική επέμβαση  με καταστροφικές (συστηματικές) ή σοβαρές συνυπάρχουσες παθήσεις - επιπλοκές;1200;5
Λ04Χ;Καταστάσεις μετά τον τοκετό ή μετά την άμβλωση με χειρουργική επέμβαση χωρίς καταστροφικές (συστηματικές) ή σοβαρές συνυπάρχουσες παθήσεις - επιπλοκές;400;2
Λ05Α;Άμβλωση με χειρουργική επέμβαση ;200;1
Λ20Α;Κολπικός τοκετός (φυσιολογικός);600;3
Λ21Α;Καταστάσεις μετά τον τοκετό ή μετά την άμβλωση χωρίς χειρουργική επέμβαση;300;2
Λ23Α;Άμβλωση χωρίς χειρουργική επέμβαση;200;1
Λ24Α;Ψευδείς ωδίνες τοκετού;200;3
Λ26Α;Προγεννητική και άλλη μαιευτική εισαγωγή;200;5
Μ01Μ;Αμφοτερόπλευρες/πολλαπλές επεμβάσεις των μεγάλων αρθρώσεων κάτω άκρων με αναθεώρηση ή με καταστροφικές (συστηματικές)  συνυπάρχουσες παθήσεις - επιπλοκές;8657;20
Μ01Χ;Αμφοτερόπλευρες/πολλαπλές επεμβάσεις των μεγάλων αρθρώσεων κάτω άκρων χωρίς αναθεώρηση  χωρίς  καταστροφικές (συστηματικές)  συνυπάρχουσες παθήσεις - επιπλοκές;4582;7
Μ02Μ;Μεταφορά μικροαγγειακού ιστού ή (δερματικού μοσχεύματος με καταστροφικές (συστηματικές) ή σοβαρές συνυπάρχουσες παθήσεις – επιπλοκές), εξαιρουμένης της άκρας χείρας;8282;20
Μ02Χ;Δερματικό μόσχευμα χωρίς καταστροφικές (συστηματικές) ή σοβαρές συνυπάρχουσες παθήσεις – επιπλοκές, εξαιρουμένης της άκρας χείρας;3000;8
Μ03Μ;Αρθροπλαστική ισχίου με καταστροφικές (συστηματικές) συνυπάρχουσες παθήσεις - επιπλοκές;4000;15
Μ03Χ;Aρθροπλαστική ισχίου χωρίς  καταστροφικές (συστηματικές) συνυπάρχουσες παθήσεις - επιπλοκές;3000;7
Μ04Μ;Αρθροπλαστική γόνατος με καταστροφικές (συστηματικές) ή σοβαρές συνυπάρχουσες παθήσεις - επιπλοκές;4400;9
Μ04Χ;Αρθροπλαστική γόνατος χωρίς καταστροφικές (συστηματικές) ή σοβαρές συνυπάρχουσες παθήσεις - επιπλοκές;4000;6
Μ05Μ;Αρθροπλαστική άλλων αρθρώσεων με καταστροφικές (συστηματικές) ή σοβαρές συνυπάρχουσες παθήσεις - επιπλοκές;5593;11
Μ05Χ;Αρθροπλαστική άλλων αρθρώσεων χωρίς καταστροφικές (συστηματικές) ή σοβαρές  συνυπάρχουσες παθήσεις - επιπλοκές;5017;6
Μ06Α;Σοβαρές επεμβάσεις της σπονδυλικής στήλης, ινιοαυχενικής μοίρας ηλικία <19 ετών ;9431;6
Μ06Μα;Σοβαρές επεμβάσεις αποκατάστασης στη σπονδυλική στήλη είτε επεμβάσεις αποκατάστασης θωρακικών παραμορφώσεων, ηλικία < 16 ετών, ή παρα/τετραπληγία με συνυπάρχουσες καταστροφικές ή σοβαρές επιπλοκές, ή επείγουσες χειρουργικές επεμβάσεις, ή επεμβάσεις για την αντιμετώπιση φλεγμονής στην περιοχή;15000;9
Μ06Μβ;Μεγάλης βαρύτητας επεμβάσεις στη σπονδυλική στήλη, με αντικατάσταση σπονδυλικού σώματος είτε για σοβαρή  φλεγμονώδη νόσο, είτε γιά κακοήθη νεοπλασία και συνυπάρχουσες καταστροφικές ή σοβαρές παθήσεις ή επιπλοκές, πάνω από 6 επίπεδα;9562;6
Μ06Μγ;Επεμβάσεις σπονδυλικής στήλης, ινιοαυχενική μοίρα, χωρίς αντικατάσταση του σπονδυλικού σώματος, χωρίς σοβαρή φλεγμονώδη νόσο ή κακοήθεια, με συνυπάρχουσες καταστροφικές ή σοβαρές παθήσεις ή επιπλοκές;8152;6
Μ06Χ;Σοβαρές επεμβάσεις στη σπονδυλική στήλη, ινιοαυχενική μοίρα, χωρίς ιδιαίτερα πολύπλοκα ή πολύ σύνθετη λειτουργία, χωρίς σπονδυλική αντικατάσταση του σώματος, χωρίς σοβαρή φλεγμονώδη νόσο ή κακόηθες νεόπλασμα, χωρίς συνυπάρχουσες καταστροφικές ή σοβαρές παθήσεις ή επιπλοκές;4136;4
Μ07Α;Ακρωτηριασμός;2000;20
Μ08Μ;Άλλες επεμβάσεις ισχίου και μηριαίου με καταστροφικές (συστηματικές)  συνυπάρχουσες παθήσεις - επιπλοκές;4449;17
Μ08Χ;Άλλες επεμβάσεις ισχίου και μηριαίου χωρίς καταστροφικές (συστηματικές)  συνυπάρχουσες παθήσεις - επιπλοκές;2765;9
Μ09Μα;Χειρουργικές επεμβάσεις στη σπονδυλική στήλη με εσωτερική οστεοσύνθεση και συνυπάρχουσες καταστροφικές ή σοβαρές  επιπλοκές ή διορθωτική οπίσθια σπονδυλοδεσία ή  αντικατάσταση σπονδυλικού σώματος με εμφύτευμα;7063;18
Μ09Μβ;Εξειδικευμένες χειρουργικές επεμβάσεις της σπονδυλικής στήλης με εσωτερική οστεοσύνθεση και σοβαρές συνοδές χειρουργικές επιπλοκές ή  αλλογενές οστικό μόσχευμα ή επεμβάσεις κυφοπλαστικής σε > 2 επίπεδα ή σε 2 επίπεδα με συνυπάρχουσες καταστροφικές ή σοβαρές επιπλοκές ;4778;3
Μ09Μγ;Εξειδικευμένες χειρουργικές επεμβάσεις στη σπονδυλική στήλη χωρίς επείγουσες παρεμβάσεις, χωρίς σπονδυλική παραμόρφωση, χωρίς σπονδυλοδεσία,  χωρίς κυφοπλαστική, με συνυπάρχουσες καταστροφικές ή σοβαρές παθήσεις ή επιπλοκές εκτός από παρα/τετραπληγία;3311;3
Μ09Χ;Σπονδυλοδεσία χωρίς καταστροφικές (συστηματικές)  συνυπάρχουσες παθήσεις - επιπλοκές έως και 3 επίπεδα;6000;7
Μ09Χα;Εξειδικευμένες χειρουργικέςεπεμβάσεις σε παραμορφωτικέςπαθήσεις της σπονδυλικής στήλης, ή πολύπλοκες σπονδυλοδεσίες ή επεμβάσεις κυφοπλαστικής χωρίς αντικατάσταση σπονδυλικού σώματος με εμφύτευμα, χωρίς οπίσθια σπονδυλοδεσία;6046;4
Μ09Χβ;Εξειδικευμένες επεμβάσεις στη σπονδυλική στήλη με εσωτερική οστεοσύνθεση με χρήση μεσοσπονδύλιων κλωβών ή κυφοπλαστική σε 2 επίπεδα χωρίς συνυπάρχουσες καταστροφικές ή σοβαρές παθήσεις ή επιπλοκές ή με αντικατάσταση σπονδυλικού σώματος ή πάρα/τετραπληγία;3628;3
Μ10Μα;Άλλες εξειδικευμένες χειρουργικές επεμβάσεις για την σπονδυλική στήλη, με συνυπάρχουσες καταστροφικές ή σοβαρές παθήσεις ή επιπλοκές ή με πολύπλοκες επεμμβάσεις;4239;8
Μ10Μβ;Άλλες εξειδικευμένες χειρουργικές επεμβάσεις για την σπονδυλική στήλη, με συνυπάρχουσες καταστροφικές ή σοβαρές παθήσεις ή επιπλοκές χωρίς πολύπλοκες επεμμβάσεις;3420;8
Μ10Χα;Άλλες χειρουργικές επεμβάσεις στη σπονδυλική στήλη, χωρίς συνυπάρχουσες καταστροφικές ή σοβαρές παθήσεις ή επιπλοκές, με σύνθετες επεμβάσεις ή έλξη μέσω Halo, με σπονδυλικό κάταγμα, με πάρα/τετραπληγία;2593;2
Μ10Χβ;Άλλες χειρουργικές επεμβάσεις στη σπονδυλική στήλη, χωρίς συνυπάρχουσες καταστροφικές ή σοβαρές παθήσεις ή επιπλοκές, με σύνθετες επεμβάσεις ή έλξη μέσω Halo, χωρίς σπονδυλικό κάταγμα, εκτός από πάρα/τετραπληγία;2172;2
Μ10Χγ;Άλλες χειρουργικές επεμβάσεις στη σπονδυλική στήλη, χωρίς συνυπάρχουσες καταστροφικές ή σοβαρές παθήσεις ή επιπλοκές, ή έλξη μέσω Halo με σύνθετες επεμβάσεις;1707;2
Μ10Χδ;Άλλες χειρουργικές επεμβάσεις στη σπονδυλική στήλη, χωρίς συνυπάρχουσες καταστροφικές ή σοβαρές παθήσεις ή επιπλοκές, ή έλξη μέσω Halo χωρίς σύνθετες επεμβάσεις;1123;2
Μ11Α;Επεμβάσεις διατατικής επιμήκυνσης άκρου;2468;4
Μ12Μα;Λοίμωξη/φλεγμονή οστού και άρθρωσης με διάφορες μυοσκελετικές επεμβάσεις με καταστροφικές (συστηματικές)  συνυπάρχουσες παθήσεις - επιπλοκές;4980;24
Μ12Μβ;Λοίμωξη/φλεγμονή οστού και άρθρωσης με διάφορες μυοσκελετικές επεμβάσεις με σοβαρές ή μέτριας βαρύτητας  συνυπάρχουσες παθήσεις - επιπλοκές;2993;14
Μ12Χ;Λοίμωξη/φλεγμονή οστού και άρθρωσης με διάφορες μυοσκελετικές επεμβάσεις χωρίς  συνυπάρχουσες παθήσεις - επιπλοκές;1514;6
Μ13Μ;Επεμβάσεις βραχιονίου, κνήμης, περόνης και αστραγάλου με συνυπάρχουσες παθήσεις - επιπλοκές;1088;10
Μ13Χ;Επεμβάσεις βραχιονίου, κνήμης, περόνης και αστραγάλου χωρίς συνυπάρχουσες παθήσεις - επιπλοκές;577;4
Μ15Α;Κρανιοπροσωπικές επεμβάσεις;3046;6
Μ16Α;Άλλες επεμβάσεις ώμου;1141;2
Μ17Μ;Γναθοπροσωπικές επεμβάσεις με συνυπάρχουσες παθήσεις - επιπλοκές;2066;3
