Η02Χ;Μείζονες επεμβάσεις των χοληφόρων χωρίς καταστροφικές (συστηματικές) ή σοβαρές  συνυπάρχουσες παθήσεις - επιπλοκές;1890;6
Η05Μ;Διαγνωστικές ηπατοχολικές επεμβάσεις με καταστροφικές (συστηματικές)  συνυπάρχουσες παθήσεις - επιπλοκές;4121;14
Η05Χ;Διαγνωστικές ηπατοχολικές επεμβάσεις χωρίς καταστροφικές (συστηματικές)  συνυπάρχουσες παθήσεις - επιπλοκές;1267;4
Η06Μ;Άλλες χειρουργικές ηπατοχολικές  επεμβάσεις και επεμβάσεις  παγκρέατος με καταστροφικές (συστηματικές)  συνυπάρχουσες παθήσεις - επιπλοκές;3565;14
Η06Χ;Άλλες χειρουργικές ηπατοχολικές επεμβάσεις και επεμβάσεις παγκρέατος χωρίς καταστροφικές (συστηματικές)  συνυπάρχουσες παθήσεις - επιπλοκές;864;5
Η07Μ;Ανοικτή χολοκυστεκτομή με κλειστό χοληδόχο πόρο ή με καταστροφικές (συστηματικές)  συνυπάρχουσες παθήσεις - επιπλοκές;3908;11
Η07Χ;Ανοικτή χολοκυστεκτομή χωρίς κλειστό χοληδόχο πόρο χωρίς καταστροφικές (συστηματικές)  συνυπάρχουσες παθήσεις - επιπλοκές;1500;6
Η08Μ;Λαπαρασκοπική χολοκυστεκτομή με κλειστό χοληδόχο πόρο ή με καταστροφικές (συστηματικές) ή σοβαρές συνυπάρχουσες παθήσεις - επιπλοκές;1600;5
Η08Χ;Λαπαρασκοπική χολοκυστεκτομή χωρίς κλειστό χοληδόχο πόρο χωρίς καταστροφικές (συστηματικές) ή σοβαρές συνυπάρχουσες παθήσεις - επιπλοκές;1085;2
Η20Μ;Ενδοσκοπικές επεμβάσεις για αιμορραγία οισοφαγικών κιρσών  με καταστροφικές (συστηματικές)  συνυπάρχουσες παθήσεις - επιπλοκές;3237;11
Η20Χ;Ενδοσκοπικές επεμβάσεις για αιμορραγία οισοφαγικών κιρσών  χωρίς καταστροφικές (συστηματικές)  συνυπάρχουσες παθήσεις - επιπλοκές;1182;5
Η23Μ;Ενδοσκοπική παλίνδρομη χολαγγειοπαγκρεατογραφία σε καταστροφικές (συστηματικές) ή σοβαρές  συνυπάρχουσες παθήσεις - επιπλοκές;1800;11
Η23Χ;Ενδοσκοπική παλίνδρομη χολαγγειοπαγκρεατογραφία σε παθήσεις χωρίς καταστροφικές (συστηματικές) ή σοβαρές  συνέπειες - επιπλοκές;651;3
Η40Μα;Κίρρωση και αλκοολική ηπατίτιδα με καταστροφικές (συστηματικές)  συνυπάρχουσες παθήσεις - επιπλοκές;1700;12
Η40Μβ;Κίρρωση και αλκοολική ηπατίτιδα με σοβαρές ή μέτριας βαρύτητας  συνυπάρχουσες παθήσεις - επιπλοκές;717;5
Η40Χ;Κίρρωση και αλκοολική ηπατίτιδα χωρίς   συνυπάρχουσες παθήσεις - επιπλοκές;296;2
Η41Μ;Κακοήθεια του ηπατοχολικού συστήματος και παγκρέατος με καταστροφικές (συστηματικές)  συνυπάρχουσες παθήσεις - επιπλοκές;1754;9
Η41Χ;Κακοήθεια του ηπατοχολικού συστήματος και παγκρέατος χωρίς καταστροφικές (συστηματικές)  συνυπάρχουσες παθήσεις - επιπλοκές;792;4
Η42Μ;Διαταραχές παγκρέατος εκτός από κακοήθεια με καταστροφικές (συστηματικές) ή σοβαρές  συνυπάρχουσες παθήσεις - επιπλοκές;1215;8
Η42Χ;Διαταραχές παγκρέατος - παγκρεατίτιδα χωρίς κακοήθεια χωρίς καταστροφικές (συστηματικές) ή σοβαρές  συνυπάρχουσες παθήσεις - επιπλοκές;447;3
Η43Μ;Διαταραχές ήπατος εκτός από κακοήθεια, κίρρωση, αλκοολική ηπατίτιδα με καταστροφικές (συστηματικές) ή σοβαρές  συνυπάρχουσες παθήσεις - επιπλοκές;1674;8
Η43Χ;Διαταραχές ήπατος εκτός από κακοήθεια, κίρρωση, αλκοολική ηπατίτιδα χωρίς καταστροφικές (συστηματικές) ή σοβαρές  συνυπάρχουσες παθήσεις - επιπλοκές;520;2
Η44Μ;Διαταραχές των χοληφόρων με  συνυπάρχουσες παθήσεις - επιπλοκές;880;6
Η44Χ;Διαταραχές των χοληφόρων χωρίς  συνυπάρχουσες παθήσεις - επιπλοκές;400;2
Θ01Μ;Χειρουργικές επεμβάσεις για επιπλοκές του διαβήτη με καταστροφικές (συστηματικές) συνυπάρχουσες παθήσεις - επιπλοκές ;4005;27
Θ01Χ;Χειρουργικές επεμβάσεις για επιπλοκές του διαβήτη χωρίς  καταστροφικές (συστηματικές) συνυπάρχουσες παθήσεις - επιπλοκές ;2547;12
Θ02Μ;Επεμβάσεις υπόφυσης με συνυπάρχουσες παθήσεις - επιπλοκές ;4668;10
Θ02Χ;Επεμβάσεις υπόφυσης χωρίς συνυπάρχουσες παθήσεις - επιπλοκές ;3014;4
Θ03Α;Επεμβάσεις επινεφριδίων;2997;4
Θ04Μ;Μείζονες επεμβάσεις για την παχυσαρκία με συνυπάρχουσες παθήσεις - επιπλοκές;3263;8
Θ04Χ;Μείζονες επεμβάσεις για την παχυσαρκία χωρίς συνυπάρχουσες παθήσεις - επιπλοκές;1503;4
Θ05Μ;Επεμβάσεις παραθυρεοειδών με καταστροφικές (συστηματικές) ή σοβαρές συνυπάρχουσες παθήσεις - επιπλοκές;2587;8
Θ05Χ;Επεμβάσεις παραθυρεοειδών χωρίς καταστροφικές (συστηματικές) ή σοβαρές συνυπάρχουσες παθήσεις - επιπλοκές;1077;3
Θ06Μ;Επεμβάσεις θυρεοειδούς με καταστροφικές (συστηματικές) ή σοβαρές συνυπάρχουσες παθήσεις - επιπλοκές;2395;5
Θ06Χ;Επεμβάσεις θυρεοειδούς χωρίς καταστροφικές (συστηματικές) ή σοβαρές συνυπάρχουσες παθήσεις - επιπλοκές;1366;2
Θ07Α;Επεμβάσεις για την παχυσαρκία;1276;3
Θ08Α;Επεμβάσεις θυρεογλωσσικού πόρου;868;2
Θ09Μα;Άλλες χειρουργικές επεμβάσεις για ενδοκρινολογικές, διατροφικές και μεταβολικές διαταραχές με καταστροφικές (συστηματικές) συνυπάρχουσες παθήσεις - επιπλοκές;4895;19
Θ09Μβ;Άλλες χειρουργικές επεμβάσεις για ενδοκρινολογικές, διατροφικές και μεταβολικές διαταραχές με σοβαρές ή μέτριας βαρύτητας συνυπάρχουσες παθήσεις - επιπλοκές;2080;7
Θ09Χ;Άλλες χειρουργικές επεμβάσεις για ενδοκρινολογικές, διατροφικές και μεταβολικές διαταραχές χωρίς καταστροφικές (συστηματικές) συνυπάρχουσες παθήσεις - επιπλοκές;1527;3
Θ10Α;Ενδοσκοπική ή διερευνητική επέμβαση για μεταβολικές διαταραχές, ημερήσια νοσηλεία ;297;1
Θ10Μ;Ενδοσκοπική ή διερευνητική επέμβαση για μεταβολικές διαταραχές με καταστροφικές (συστηματικές) συνυπάρχουσες παθήσεις - επιπλοκές;4296;18
Θ10Χ;Ενδοσκοπική ή διερευνητική επέμβαση για μεταβολικές διαταραχές χωρίς καταστροφικές (συστηματικές) συνυπάρχουσες παθήσεις - επιπλοκές;1580;7
Θ20Μ;Διαβήτης με καταστροφικές (συστηματικές) ή σοβαρές συνυπάρχουσες παθήσεις - επιπλοκές;1735;18
Θ20Χ;Διαβήτης χωρίς καταστροφικές (συστηματικές) ή σοβαρές συνυπάρχουσες παθήσεις - επιπλοκές;731;3
Θ21Α;Σοβαρή διατροφική διαταραχή ;1800;12
Θ22Μ;Διάφορες  μετοβολικές διαταραχές με καταστροφικές (συστηματικές)  ή σοβαρές συνυπάρχουσες παθήσεις - επιπλοκές;1092;7
Θ22Χ;Διάφορες  μεταβολικές διαταραχές χωρίς καταστροφικές (συστηματικές) ή σοβαρές συνυπάρχουσες παθήσεις - επιπλοκές;482;2
Θ23Μ;Συγγενείς διαταραχές του μεταβολισμού με συνυπάρχουσες παθήσεις - επιπλοκές;1074;5
Θ23Χ;Συγγενείς διαταραχές του μεταβολισμού χωρίς συνυπάρχουσες παθήσεις - επιπλοκές;156;3
Θ24Μ;Ενδοκρινολογικές διαταραχές με καταστροφικές (συστηματικές) ή σοβαρές συνυπάρχουσες παθήσεις - επιπλοκές;1829;9
Θ24Χ;Ενδοκρινολογικές διαταραχές χωρίς καταστροφικές (συστηματικές) ή σοβαρές συνυπάρχουσες παθήσεις - επιπλοκές;428;3
Ι20Α;Τοξίκωση από οινοπνευματώδη και κατάσταση απόσυρσης (σύνδρομο στέρησης) ;0;0
Ι21Α;Τοξίκωση από ψυχοδραστικές ουσίες (ναρκωτικά) και κατάσταση απόσυρσης (σύνδρομο στέρησης) ;0;0
Ι22Μ;Διαταραχή από χρήση οινοπνευματωδών και εξάρτηση;0;0
Ι22Χ;Διαταραχή από χρήση οινοπνευματωδών και εξάρτηση, ημερήσια νοσηλεία;0;0
Ι23Α;Διαταραχή από χρήση οπιοειδών και εξάρτηση;0;0
Ι24Α;Διαταραχή από χρήση άλλων ψυχοδραστικών ουσιών (ναρκωτικών) και εξάρτηση;0;0
Κ01Μ;Εμφύτευση  αυτόματου εμφυτεύσιμου καρδιακού απινιδωτή, ολοκληρωμένο σύστημα, με καταστροφικές (συστηματικές) συνυπάρχουσες παθήσεις - επιπλοκές;12500;12
Κ01Χ;Εμφύτευση  αυτόματου εμφυτεύσιμου καρδιακού απινιδωτή, ολοκληρωμένο σύστημα, χωρίς καταστροφικές (συστηματικές) συνυπάρχουσες παθήσεις - επιπλοκές;11291;3
Κ02Α;Άλλες επεμβάσεις σχετιζόμενες με αυτόματο εμφυτεύσιμο καρδιακό απινιδωτή;1897;4
Κ03Μ;Επεμβάσεις καρδιακών βαλβίδων με χρήση εξωσωματικής κυκλοφορίας με επεμβατικό καρδιακό καθετηριασμό με καταστροφικές (συστηματικές) συνυπάρχουσες παθήσεις;11277;23
Κ03Χ;Επεμβάσεις καρδιακών βαλβίδων με χρήση εξωσωματικής κυκλοφορίας με επεμβατικό καρδιακό καθετηριασμό χωρίς καταστροφικές (συστηματικές) συνυπάρχουσες παθήσεις;7475;13
Κ04Μ;Επεμβάσεις καρδιακών βαλβίδων με χρήση εξωσωματικής κυκλοφορίας χωρίς επεμβατικό καρδιακό καθετηριασμό με καταστροφικές (συστηματικές) συνυπάρχουσες παθήσεις;8922;14
Κ04Χ;Επεμβάσεις καρδιακών βαλβίδων με χρήση εξωσωματικής κυκλοφορίας χωρίς επεμβατικό καρδιακό καθετηριασμό χωρίς καταστροφικές (συστηματικές) συνυπάρχουσες παθήσεις;5828;8
Κ05Μ;Στεφανιαία παράκαμψη με επεμβατικό καρδιακό καθετηριασμό με επανεπέμβαση ή με καταστροφικές (συστηματικές) συνυπάρχουσες παθήσεις-επιπλοκές;8826;18
Κ05Χ;Στεφανιαία παράκαμψη με επεμβατικό καρδιακό καθετηριασμό χωρίς επανεπέμβαση χωρίς καταστροφικές (συστηματικές) συνυπάρχουσες παθήσεις-επιπλοκές;6495;13
Κ06Μ;Στεφανιαία παράκαμψη χωρίς επεμβατικό καρδιακό καθετηριασμό με επανεπέμβαση ή με καταστροφικές (συστηματικές) ή σοβαρές συνυπάρχουσες παθήσεις-επιπλοκές;5924;10
Κ06Χ;Στεφανιαία παράκαμψη χωρίς επεμβατικό καρδιακό καθετηριασμό χωρίς επανεπέμβαση χωρίς καταστροφικές (συστηματικές) ή σοβαρές συνυπάρχουσες παθήσεις-επιπλοκές;4276;7
Κ07Μα;Άλλες καρδιο-θωρακοχειρουργικές /αγγειοχειρουργικές επεμβάσεις με χρήση εξωσωματικής κυκλοφορίας με καταστροφικές (συστηματικές) συνυπάρχουσες παθήσεις-επιπλοκές ;8818;12
Κ07Μβ;Άλλες καρδιο-θωρακοχειρουργικές /αγγειοχειρουργικές επεμβάσεις με χρήση εξωσωματικής κυκλοφορίας με σοβαρές ή μέτριας βαρύτητας συνυπάρχουσες παθήσεις-επιπλοκές ;6061;8
Κ07Χ;Άλλες καρδιο-θωρακοχειρουργικές /αγγειοχειρουργικές επεμβάσεις με χρήση εξωσωματικής κυκλοφορίας χωρίς συνυπάρχουσες παθήσεις-επιπλοκές ;4758;7
Κ08Μ;Μείζονες επανορθωτικές επεμβάσεις αγγείων χωρίς χρήση εξωσωματικής κυκλοφορίας με καταστροφικές (συστηματικές) συνυπάρχουσες παθήσεις-επιπλοκές;7218;16
Κ08Χ;Μείζονες επανορθωτικές επεμβάσεις αγγείων χωρίς χρήση εξωσωματικής κυκλοφορίας χωρίς καταστροφικές (συστηματικές) συνυπάρχουσες παθήσεις-επιπλοκές;4219;7
Κ09Μα;Άλλες καρδιοθωρακικές χειρουργικές επεμβάσεις χωρίς χρήση εξωσωματικής κυκλοφορίας με καταστροφικές (συστηματικές) συνυπάρχουσες παθήσεις-επιπλοκές;5136;10
Κ09Μβ;Άλλες καρδιοθωρακικές χειρουργικές επεμβάσεις χωρίς χρήση εξωσωματικής κυκλοφορίας με σοβαρές ή μέτριας βαρύτητας συνυπάρχουσες παθήσεις-επιπλοκές;3167;6
Κ09Χ;Άλλες καρδιοθωρακικές χειρουργικές επεμβάσεις χωρίς χρήση εξωσωματικής κυκλοφορίας χωρίς συνυπάρχουσες παθήσεις-επιπλοκές;2169;4
Κ10Μ;Διαδερμικές επεμβάσεις στεφανιαίων αγγείων με ΟΕΜ (οξύ έμφραγμα μυοκαρδίου) με καταστροφικές (συστηματικές) συνυπάρχουσες παθήσεις-επιπλοκές;4166;8
Κ10Χ;Διαδερμικές επεμβάσεις στεφανιαίων αγγείων με ΟΕΜ (οξύ έμφραγμα μυοκαρδίου) χωρίς καταστροφικές (συστηματικές) συνυπάρχουσες παθήσεις-επιπλοκές;2724;4
Κ11Μ;Ακρωτηριασμός λόγω παθήσεων του κυκλοφορικού,  εξαιρουμένων των άνω άκρου και δακτύλων άκρου ποδός,  με καταστροφικές (συστηματικές) συνυπάρχουσες παθήσεις-επιπλοκές;6629;27
Κ11Χ;Ακρωτηριασμός λόγω παθήσεων του κυκλοφορικού,  εξαιρουμένων των άνω άκρου και δακτύλων άκρου ποδός, χωρίς καταστροφικές (συστηματικές) συνυπάρχουσες παθήσεις-επιπλοκές;2930;14
Κ12Μ;Εμφύτευση βηματοδότη, ολοκληρωμένο σύστημα, με καταστροφικές (συστηματικές) συνυπάρχουσες παθήσεις-επιπλοκές;3280;11
Κ12Χ;Εμφύτευση βηματοδότη, ολοκληρωμένο σύστημα, χωρίς καταστροφικές (συστηματικές) συνυπάρχουσες παθήσεις-επιπλοκές;2831;4
Κ13Μ;Ακρωτηριασμός άνω άκρου και δακτύλων άκρου ποδός λόγω διαταραχών του κυκλοφορικού με καταστροφικές (συστηματικές) ή σοβαρές συνυπάρχουσες παθήσεις-επιπλοκές;3608;17
Κ13Χ;Ακρωτηριασμός άνω άκρου ή δακτύλων άκρου ποδός λόγω παθήσεων του κυκλοφορικού χωρίς καταστροφικές (συστηματικές) ή σοβαρές συνυπάρχουσες παθήσεις-επιπλοκές;1139;7
Κ14Μα;Αγγειακές επεμβάσεις, εξαιρουμένων των μειζόνων επανορθωτικών επεμβάσεων, χωρίς εξωσωματική κυκλοφορία, με καταστροφικές (συστηματικές) συνυπάρχουσες παθήσεις-επιπλοκές;3245;11
Κ14Μβ;Αγγειακές επεμβάσεις, εξαιρουμένων των μειζόνων επανορθωτικών επεμβάσεων, χωρίς εξωσωματική κυκλοφορία, με σοβαρές ή μέτριας βαρύτητας συνυπάρχουσες παθήσεις-επιπλοκές;1810;4
Κ14Χ;Αγγειακές επεμβάσεις, εξαιρουμένων των μειζόνων επανορθωτικών επεμβάσεων, χωρίς εξωσωματική κυκλοφορία, χωρίς συνυπάρχουσες παθήσεις-επιπλοκές;1125;2
Κ15Μ;Διαδερμικές επεμβάσεις στεφανιαίων αγγείων χωρίς ΟΕΜ (οξύ έμφραγμα μυοκαρδίου) με εμφύτευση ενδοπρόθεσης (stent) με καταστροφικές (συστηματικές) ή σοβαρές συνυπάρχουσες παθήσεις-επιπλοκές;1945;4
Κ15Χ;Διαδερμικές επεμβάσεις στεφανιαίων αγγείων χωρίς ΟΕΜ (οξύ έμφραγμα μυοκαρδίου) με εμφύτευση ενδοπρόθεσης (stent) χωρίς καταστροφικές (συστηματικές) ή σοβαρές συνυπάρχουσες παθήσεις-επιπλοκές;1761;2
Κ16Μ;Διαδερμικές επεμβάσεις στεφανιαίων αγγείων χωρίς ΟΕΜ (οξύ έμφραγμα μυοκαρδίου) χωρίς εμφύτευση ενδοπρόθεσης (stent) με συνυπάρχουσες παθήσεις-επιπλοκές;1392;3
Κ16Χ;Διαδερμικές επεμβάσεις στεφανιαίων αγγείων χωρίς ΟΕΜ (οξύ έμφραγμα μυοκαρδίου) χωρίς εμφύτευση ενδοπρόθεσης (stent) χωρίς συνυπάρχουσες παθήσεις-επιπλοκές;1016;2
Κ17Μ;Αντικατάσταση βηματοδοτικής πηγής με καταστροφικές (συστηματικές) ή σοβαρές συνυπάρχουσες παθήσεις-επιπλοκές;2629;5
Κ17Χ;Αντικατάσταση βηματοδοτικής πηγής χωρίς καταστροφικές (συστηματικές) ή  σοβαρές συνυπάρχουσες παθήσεις-επιπλοκές;2227;1
Κ18Μ;Άλλες επεμβάσεις για βηματοδότη με συνυπάρχουσες παθήσεις-επιπλοκές;2023;7
Κ18Χ;Άλλες επεμβάσεις για βηματοδότη χωρίς συνυπάρχουσες παθήσεις-επιπλοκές;1045;2
Κ19Α;Διαδερμικές ενδοαγγειακές καρδιακές επεμβάσεις;2903;3
Κ20Α;Απολίνωση και εκρίζωση φλέβας;691;1
Κ21Μ;Άλλες χειρουργικές επεμβάσεις για παθήσεις του κυκλοφορικού  με καταστροφικές (συστηματικές) συνυπάρχουσες παθήσεις-επιπλοκές;2187;13
Κ21Χ;Άλλες χειρουργικές επεμβάσεις για παθήσεις του κυκλοφορικού  χωρίς καταστροφικές (συστηματικές) συνυπάρχουσες παθήσεις-επιπλοκές;1358;4
Κ22Α;Αορτικά βαλβιδοφόρα μοσχεύματα;7048;11
Κ30Μ;Πάθηση του κυκλοφορικού με μηχανική υποστήριξη αναπνοής με καταστροφικές (συστηματικές) συνυπάρχουσες παθήσεις-επιπλοκές;5401;11
Κ30Χ;Πάθηση του κυκλοφορικού με μηχανική υποστήριξη αναπνοής χωρίς καταστροφικές (συστηματικές) συνυπάρχουσες παθήσεις-επιπλοκές;3649;6
Κ31Μ;Διαταραχές του κυκλοφορικού με ΟΕΜ (οξύ έμφραγμα μυοκαρδίου) με επεμβατικό καρδιακό καθετηριασμό με καταστροφικές (συστηματικές) ή σοβαρές συνυπάρχουσες παθήσεις-επιπλοκές;1853;8
Κ31Χ;Διαταραχές του κυκλοφορικού με ΟΕΜ (οξύ έμφραγμα μυοκαρδίου) με επεμβατικό καρδιακό καθετηριασμό χωρίς καταστροφικές (συστηματικές) ή σοβαρές συνυπάρχουσες παθήσεις-επιπλοκές;1078;4
Κ32Α;Διαταραχές του κυκλοφορικού χωρίς ΟΕΜ (οξύ έμφραγμα μυοκαρδίου)  με επεμβατικό καρδιακό καθετηριασμό, ημερήσια νοσηλεία;498;1
Κ32Μ;Διαταραχές του κυκλοφορικού χωρίς ΟΕΜ (οξύ έμφραγμα μυοκαρδίου) με επεμβατικό καρδιακό καθετηριασμό με καταστροφικές (συστηματικές) ή σοβαρές συνυπάρχουσες παθήσεις-επιπλοκές;1875;8
Κ32Χ;Διαταραχές του κυκλοφορικού χωρίς ΟΕΜ (οξύ έμφραγμα μυοκαρδίου) με επεμβατικό καρδιακό καθετηριασμό χωρίς καταστροφικές (συστηματικές) ή σοβαρές συνυπάρχουσες παθήσεις-επιπλοκές;968;3
Κ33Α;Πάθηση του κυκλοφορικού με μη επεμβατικό αερισμό;1851;13
Κ33Μ;Φλεβική θρόμβωση με  καταστροφικές (συστηματικές) ή σοβαρές συνυπάρχουσες παθήσεις-επιπλοκές;1337;8
Κ33Χ;Φλεβική θρόμβωση χωρίς καταστροφικές (συστηματικές) ή σοβαρές συνυπάρχουσες παθήσεις-επιπλοκές;577;5
